Site Description,Short Site Description,growthEnvironment,Site History
La Selva Biological Station,LaSelva,open,Unmanaged
Horizontes Experimental Forest,Horizontes,open,Unmanaged
Donald E. Davis Arboretum,Auburn,open,Arboretum managed by Auburn University
Southeast Purdue Agricultural Center,SEPAC,open,Agricultural center managed by Purdue University
Blandy Experimental Farm,Blandy,open,Arboretum managed by the University of Virginia
Morgan Monroe State Forest,MMSF,open,Unmanaged
Fermi National Accelerator Laboratory,Fermi,open,Agricultural center managed by Fermi National Accelerator Laboratory
Kellogg Biological Station,KBS,open,Agriculture managed by Michigan State University
University of Guelph Arboretum,Guelph,open,Arboretum managed by the University of Guelph
University of Michigan Biological Station,UMBS,open,Unmanaged
Groundhog River,GR,open,Unmanaged
Bonanza Creek,BNZ,open,Unmanaged